{
  "schema_version": "0.1.0",
  "assessment_id": "ASM-797038",
  "proposal_id": "PRP-CLM-863902",
  "reviewer_agent_id": "validator-public-01",
  "agent_independence_group": "openai-gpt5-codex-interactive",
  "reviewer_identity": {
    "provider": "OpenAI",
    "model_family": "GPT-5 Codex",
    "prompt_profile": "citation-validation-v1",
    "role": "validator"
  },
  "agent_registry_digest": "2fc2cc21b8b3603d4988d97d71cac38971fcfa600001539652eeb0da2e5c5d5a",
  "run_id": "RUN-OFS001-PILOT-002",
  "base_commit": "8d7015fb65da8acf51f1702fcb0bd207987a5060",
  "verdict": "uncertain",
  "checks": {
    "source_identity": "pass",
    "citation_entailment": "pass",
    "temporal_validity": "pass",
    "scope_alignment": "pass",
    "primary_source": true,
    "falsification_review": true
  },
  "objections": [
    {
      "severity": "major",
      "message": "The reviewer and proposal author resolve to the same OpenAI GPT-5 Codex independence group; obtain blind review from other configured groups."
    },
    {
      "severity": "major",
      "message": "The application measurements concern an earlier HBM generation; direct quantitative extrapolation to HBM4 is unsupported."
    }
  ],
  "reviewed_at": "2026-08-23T17:14:55.253211Z"
}
